{
  "contractVersion": "1.1.0",
  "courseId": "american-football",
  "curriculumVersion": "0.1.0",
  "locale": "en-US",
  "concepts": [
    {
      "id": "downs",
      "term": "Downs",
      "definition": "The offense gets four plays (downs) to gain 10 yards. Gain them and the count resets.",
      "exampleLine": "They have to go for it on fourth down.",
      "tier": "foundations"
    },
    {
      "id": "quarterback",
      "term": "Quarterback",
      "definition": "The player who runs the offense and throws most passes.",
      "exampleLine": "Their quarterback looks calm under pressure.",
      "tier": "foundations",
      "relatedConceptIds": [
        "downs"
      ]
    },
    {
      "id": "game-clock",
      "term": "Game clock",
      "definition": "Sixty minutes of playing time in four quarters; the clock stops often, so games take about three hours.",
      "exampleLine": "They are just trying to run out the clock.",
      "tier": "foundations"
    },
    {
      "id": "secondary",
      "term": "Secondary",
      "definition": "The defensive backs: cornerbacks and safeties who cover receivers.",
      "exampleLine": "Our secondary is getting torched.",
      "tier": "intermediate",
      "aliases": [
        "defensive backs",
        "DBs"
      ]
    },
    {
      "id": "strong-safety",
      "term": "Strong safety",
      "definition": "The safety who lines up on the tight end side and helps against the run and short passes.",
      "exampleLine": "The strong safety came up to stop the run.",
      "tier": "intermediate",
      "relatedConceptIds": [
        "secondary"
      ]
    }
  ],
  "talkTracks": [
    {
      "id": "game-night-text",
      "title": "Game night text",
      "unlockedByUnitId": "the-basics",
      "conceptIds": [
        "downs"
      ],
      "payload": {
        "title": "Hockey night",
        "setting": "She texts after her team wins in overtime.",
        "startingSmooth": 50,
        "exchanges": [
          {
            "theirMessage": "OT winner!! Power play goal, we finally got the man advantage.",
            "replies": [
              {
                "id": "a",
                "text": "Nice, the power play finally clicked?",
                "smoothDelta": 30,
                "theirResponse": "YES. It had been 0 for 14.",
                "coachNote": "You picked up the term and asked about it."
              },
              {
                "id": "b",
                "text": "Cool, so who won?",
                "smoothDelta": -20,
                "theirResponse": "...We did. It is in my text.",
                "coachNote": "Read her message first."
              }
            ]
          }
        ],
        "closingNote": "A power play is a two-minute man advantage after a penalty."
      }
    }
  ],
  "reviewPolicy": {
    "algorithm": "leitner-boxes-v1",
    "intervalsDays": [
      1,
      3,
      7,
      14,
      30,
      60
    ],
    "maxItemsPerSession": 10,
    "masteryThreshold": 0.8,
    "decayAfterDays": 45,
    "reviewActivityTypes": [
      "multiple-choice",
      "fill-the-gap",
      "term-match",
      "say-this"
    ]
  },
  "unitOrder": [
    "the-basics",
    "defense-basics"
  ]
}
